{
  "manifest_id": "manifest-study-001",
  "schema_version": "1.1.0",
  "revision": 1,
  "study_id": "SYNTH-ONCO-001",
  "created_at": "2026-07-13T00:00:00Z",
  "pipeline_contract": {"artifact_id": "contract-pipeline-001", "version": "1.0.0", "sha256": "1111111111111111111111111111111111111111111111111111111111111111"},
  "workflow_knowledge": {"provider": "local-wiki", "snapshot_id": "snapshot-workflow-001", "version": "1.0.0", "sha256": "2222222222222222222222222222222222222222222222222222222222222222", "fallback_path": "workflow/snapshots/workflow-001.json", "contract_compatibility": {"minimum": "1.0.0", "maximum_exclusive": "2.0.0"}},
  "domain_knowledge": {"provider": "local-wiki", "snapshot_id": "snapshot-domain-001", "version": "1.0.0", "sha256": "3333333333333333333333333333333333333333333333333333333333333333", "fallback_path": "knowledge/snapshots/domain-001.json", "contract_compatibility": {"minimum": "1.0.0", "maximum_exclusive": "2.0.0"}},
  "toolchain": {"registry_version": "1.0.0", "git_commit": "abcdef0", "registry_sha256": "4444444444444444444444444444444444444444444444444444444444444444", "capabilities": ["sdtm_spec_generation", "cdisc_validation"]},
  "policies": {"live_upgrade": "forbidden", "conflict": "fail_closed", "version": "exact_manifest", "fallback": "locked_snapshot_only"},
  "manifest_sha256": "5555555555555555555555555555555555555555555555555555555555555555"
}
